{
  "build": {
    "bytecode_hash": "none",
    "cbor_metadata": false,
    "evm_version": "cancun",
    "forge_commit": "9979a41b5daa5da1572d973d7ac5a3dd2afc0221",
    "forge_version": "1.3.5-stable",
    "optimizer": true,
    "optimizer_runs": 10000,
    "profile": "default",
    "solc_version": "0.8.30",
    "via_ir": false
  },
  "chain": {
    "chain_id": 4663,
    "p256_verifier": {
      "address": "0x0000000000000000000000000000000000000100",
      "gas": 6900,
      "standard": "EIP-7951"
    }
  },
  "contracts": {
    "builder_account": {
      "abi": {
        "byte_length": 21052,
        "path": "abi/BuilderAccount.json",
        "sha256": "0xd93d030b2d372b74325e921e0081572284a68cb58fc553342d37ba55b6f150be"
      },
      "component_version": "0.8.0",
      "creation_bytecode": {
        "byte_length": 25907,
        "path": "bytecode/BuilderAccount.creation.hex",
        "sha256": "0xb51d7e5d1bfe1dc92e561642e70e0af20bee93fe1d936260231d181e99fbabef"
      },
      "creation_code_keccak256": "0xd7a8e6d4678ba3cdfd73750c75455b2d29cf0ec3ef3190c94adfb6baf15e7405",
      "runtime_code_keccak256": "0xfb669f5ab8e1d9a665bcde72f09f8d38c781c6b30056a516244a4abf0cc1afe7"
    },
    "builder_account_factory": {
      "abi": {
        "byte_length": 1637,
        "path": "abi/BuilderAccountFactory.json",
        "sha256": "0x8b56544e58fa5ff7ec2ea5daeab432dab2cc64bc36fa022395703778441b475b"
      },
      "component_version": "0.8.0",
      "creation_bytecode": null,
      "creation_code_keccak256": "0x4a06468df5e31a81a23c5874258de8b3c3c70031a27c98fb8ef677f061c854eb",
      "runtime_code_keccak256": "0xb880403ff0da9a3f4c0c982cdea56fb198912c66bc436305e20861378f45c5f4"
    },
    "shot_registry": {
      "abi": {
        "byte_length": 19772,
        "path": "abi/ShotRegistry.json",
        "sha256": "0x5e01686c1c512d18fdc354480a863ab4852c721e751da14df74b0c4c0c4c50a5"
      },
      "component_version": "0.8.0",
      "creation_bytecode": null,
      "creation_code_keccak256": "0x865bf1508195e35de9e0b0620f0bbc9026485a6022e755369ce6fad1c825cf6b",
      "runtime_code_keccak256": "0xb6279467956165a9520803fdfe5a2254c98569b71541bf67d57fcd54ab3a2524"
    }
  },
  "create2": {
    "builder_account_factory": {
      "init_code_keccak256": "0x4a06468df5e31a81a23c5874258de8b3c3c70031a27c98fb8ef677f061c854eb",
      "predicted_address": "0xb1bd208cd2af98e701f43d06aaa889d3a594df65",
      "salt": "0x5fd2db5a85724a3ec24a912bfbf24fc577d26b53aafaf22e45dd425901249ef4"
    },
    "deployer": "0x4e59b44847b379578588920ca78fbf26c0b4956c",
    "shot_registry": {
      "init_code_keccak256": "0x865bf1508195e35de9e0b0620f0bbc9026485a6022e755369ce6fad1c825cf6b",
      "predicted_address": "0x3fe6508ba2660bc575080024f402c192a2e035a0",
      "salt": "0x9c40694097bc8150c4d1b158a4947ebce701ac78a428182953119033cb17f8c4"
    }
  },
  "generation": "0.8.0",
  "protocol": "tohseno",
  "protocol_major": 2,
  "schema": "tohseno.contract-generation/1",
  "source": {
    "commit": "862ca6cd3d396271b56b336fee0513ddcf6ecc64",
    "files": [
      {
        "byte_length": 308,
        "path": "foundry.toml",
        "sha256": "0xc0d7531e20f4ab32f409865bfc12d3c0183fbc8eeb5fdc824e6f79b6fed2fe83"
      },
      {
        "byte_length": 17488,
        "path": "src/BuilderAccount.sol",
        "sha256": "0x5dc87d036030f4250c034189c6602e33b3368d5bc7dd628aa55ec558f23f3937"
      },
      {
        "byte_length": 1204,
        "path": "src/BuilderAccountFactory.sol",
        "sha256": "0x1887ee0605aca9c5b6609bc93fb068011b2e3485ddd9c4e0e00384a5261c7dac"
      },
      {
        "byte_length": 953,
        "path": "src/EIP712Domain.sol",
        "sha256": "0xd098361cf177a1f461828a95d42888ef68bc41d732deb4013a43c693da3fe31c"
      },
      {
        "byte_length": 191,
        "path": "src/IERC1271.sol",
        "sha256": "0x1deefadaa015848bf54f30e73da532d90d74ece8b0004de6be31fa6d6403aca4"
      },
      {
        "byte_length": 3196,
        "path": "src/P256Verifier.sol",
        "sha256": "0xac0b72ce859b4a5761186f69589d805344fac70ebb1c83445bb726c0ecdcb14c"
      },
      {
        "byte_length": 13789,
        "path": "src/ShotRegistry.sol",
        "sha256": "0x734fe0288c3413a3cb86e6d53da3a8f081d8b6890e162deb26eefddc9e85bd94"
      }
    ],
    "tree_law": "tohseno.contract-source-tree/1",
    "tree_sha256": "0x5d8c56423f9b9cb97d8e05834a6a2e776034b1257a186e47f25869bf509910c3"
  }
}
